<?xml version="1.0" encoding="ISO-8859-1"?>
<!ELEMENT europe_countries (country*)>
<!ELEMENT country (name, population, capital)>
<!ELEMENT name (#PCDATA)>
<!ELEMENT population (#PCDATA)>
<!ELEMENT capital (#PCDATA)>
